{
  "schemaVersion": 1,
  "status": "approved",
  "proposalHash": "sha256:7958bc825f4133a89b3c3f0d8ab05b9c42ec58bc4f0cf62279e9badda1a68614",
  "evidenceHash": "sha256:1982e89cebb147bc8134ef64ca9aabee9cf134ef0dbf53c5688f621c9e247fd9",
  "approvedAt": "2026-07-24",
  "approvedBy": "Little-FishK",
  "tutorial": {
    "decision": "approve"
  },
  "concepts": [
    {
      "term": "AI Agent",
      "decision": "approve"
    },
    {
      "term": "System Prompt",
      "decision": "approve"
    },
    {
      "term": "Agent Memory / 会话记忆",
      "decision": "approve"
    },
    {
      "term": "确定性工作流与 Agent 混合编排",
      "decision": "approve"
    },
    {
      "term": "GPT / 具体聊天模型",
      "decision": "reject"
    },
    {
      "term": "Multimodal",
      "decision": "reject"
    },
    {
      "term": "Vector Database",
      "decision": "reject"
    },
    {
      "term": "Chat Trigger",
      "decision": "reject"
    }
  ],
  "notes": "批准创建 n8n 教程页，并将四项现有节点补充送入写作队列；不新增节点、不调整核心身份。"
}
